retrieval_gt,qid,query,generation_gt
[['8700e2b1-9c65-4dad-be62-e5769cd6241c']],ecea4b09-c5a3-4e06-ad9d-ea4deb34724f,‘내부자금’이란 무엇인가요?,"['내부자금은 기업이 자신들 안에서 필요한 돈을 마련하는 방법을 말해요. 쉽게 말해, 집에서 자금을 마련하는 거죠. 예를 들어, 여러분이 친구들과 피자를 먹기 위해 돈을 모을 때, 아르바이트로 번 돈을 피자 비용으로 사용하는 것을 생각해보세요. 여기서 아르바이트로 번 돈이 내부자금이라 할 수 있습니다. 그런 방식으로 기업도 내부에서 발생한 이익이나 감가상각충당금 같은 것을 사용해 필요한 투자를 하게 돼요. 내부자금의 장점은 은행에 이자를 내거나 다른 사람에게 돈을 빌리는 것보다 비용이 들지 않는다는 점이에요. 기업이 새로운 기계를 사기 위해 은행에 빚지 않으려면 아르바이트로 번 돈을 모아 새로운 게임기를 사는 것처럼 내부자금을 활용하는 것이죠.']"
[['a8485395-0f90-448e-9375-f96885d0b7b7']],91128e6b-7e4b-4e3a-8b54-8eae207c1ad6,'전자정보교환제도'란 무엇인가요?,"['전자정보교환제도는 쉽게 말해 은행 같은 금융기관에서 공과금이나 수표를 처리할 때, 실물 종이를 직접 주고받지 않고, 컴퓨터를 통해 정보를 주고받는 시스템이에요. 예를 들어, 친구에게 수표를 보낼 때 직접 만나서 종이를 주는 대신, 그 내용을 전자적으로 전달하는 것과 비슷하죠. 이렇게 하면 종이를 잃어버릴 걱정도 없고, 처리 시간과 비용도 줄일 수 있어요. 이 제도 덕분에 은행 업무가 더욱 효율적이고 안전하게 이루어질 수 있게 되었답니다.']"
[['6295ee29-18e1-4a86-afbd-3c88119eeee6']],ab487d18-6688-4f9c-b3a7-c632ed1a6521,'외국환업무취급기관'과 '외국환은행'은 무엇인가요?,"[""외국환업무취급기관과 외국환은행은 외국의 돈, 즉 외화를 다루는 금융기관을 의미해요. 외화를 다룬다는 것은 우리가 여행을 갈 때 환전하거나, 해외로 돈을 송금하는 일을 포함하는데, 이런 업무를 전문적으로 하는 곳들이 바로 외국환업무취급기관이에요.\n\n'외국환업무취급기관'은 경제적으로 튼튼하고, 외환 업무를 처리할 수 있는 전문 인력과 시스템을 갖춘 기관을 말해요. 흔히 우리가 보기에는 은행 같은 곳들이죠. 예를 들어, 외환 업무를 원활하게 처리하기 위해 이 기관들은 컴퓨터 시스템으로 세계 여러 나라와 연결되어 있어요.\n\n한편, '외국환은행'은 그중에서도 우리가 많이 들어본 일반 은행들처럼 은행법에 의해 관리되는 곳입니다. 외국환은행은 외화와 관련된 거의 모든 업무를 다룰 수 있는 능력을 가지고 있어요. 즉, 우리가 외국에서 직접 송금하거나 환전하는 일 등을 도와주는 은행을 외국환은행이라고 할 수 있어요.\n\n쉽게 말해, 외국환업무취급기관 전체가 외화를 다루는 곳이라면, 그중에서도 외국환은행은 특히 다양한 외환 서비스를 제공할 수 있는 다재다능한 은행이라고 할 수 있답니다. 그래서 해외 여행을 가거나, 외국 제품을 살 때 외화를 다뤄야 할 일이 생긴다면, 이런 기관들을 통해 안전하고 쉽게 거래할 수 있어요.""]"
[['9ad0cadd-4906-4277-be8d-406206a2c7bc']],2e9a6544-3bea-4eb9-8745-d881eedaac5e,‘납부자자동이체’란 무엇인가요?,"['납부자자동이체는 은행에서 제공하는 편리한 서비스로, 정기적으로 지불해야 하는 금액을 자동으로 다른 계좌로 이체해 주는 시스템입니다. 예를 들어, 매달 납부해야 하는 월세나 적금에 가입해 있는 경우, 은행에 직접 방문하거나 신경 쓰지 않아도 거래은행에서 자동으로 해당 금액을 다른 은행의 계좌로 보내줍니다. 말 그대로 시간을 절약해 주는 고마운 친구 같은 서비스인 셈이죠! \n\n이 서비스는 대출 원리금, 적금 납입금, 그리고 각종 기부금이나 회비 같은 정기적인 지출 항목에서 유용하게 쓰이는데요, 한 번 등록해 두면 매달 빠뜨리지 않고 정확하게 납부할 수 있어요. 덕분에 중요한 납부 일정을 잊어버릴 걱정 없이 경제 활동을 할 수 있답니다.']"
[['f0d7f6ff-f9fb-4baf-8a08-cd4ce158b2d0']],aed57ea0-0d4e-450f-a7eb-38c91e0142c2,'수출보험'이란 무엇인가요?,"['수출보험은 수출업자가 물건을 외국에 팔 때, 여러 가지 예기치 못한 상황으로 인해 대금을 받지 못하는 위험을 막기 위해 사용하는 보험입니다. 예를 들어, 김씨가 한국에서 만들어진 제품을 해외의 한 고객에게 팔고 대금을 받기 위해 기다리고 있다고 가정해보세요. 그런데 만약 그 해외 국가에서 갑자기 전쟁이 발생하거나, 정부가 이유 없이 외환거래를 막아버린다면, 김씨는 돈을 받지 못할 수도 있습니다. 이런 상황에서 수출보험은 김씨처럼 수출을 하는 사람들이 손해를 보지 않도록 도와줍니다. 한국무역보험공사에서 제공하는 이 보험은 여러 리스크로부터 수출업자를 보호하고 안정적으로 거래를 할 수 있게 해 줍니다.']"
[['300a9acf-b546-4a22-a907-b5e4fbce5d54']],0b6a545b-2afe-4196-90ae-0d7f8b725f2b,"""매입외환""과 ""환가료""라는 단어는 어떤 의미인가요?","['매입외환은 은행이 고객의 요청으로 외국통화로 표시된 수출환어음이나 외화수표 같은 금융자산을 매입하는 것을 의미해요. 이를 통해 고객은 외화 대신 원화로 돈을 손쉽게 받을 수 있죠. 예를 들어, 해외 거래를 통해 외화를 받아야 하는 한국의 수출 기업이 은행을 통해 그 외화를 원화로 바꾸게 되는 것과 비슷해요.\n\n""환가료""는 은행이 고객으로부터 외환을 매입하여 원화를 지급하고 외화를 회수하는 동안 대출해주는 것과 비슷한 효과가 생기는데, 그 과정에서 발생하는 수수료를 의미해요. 쉽게 말해서, 은행이 고객 대신 돈을 미리 줌으로써 발생하는 금융 비용이라고 할 수 있어요. 마치 친구가 아직 돈을 받지 못했는데도 미리 여행 경비를 빌려주는 것과 비슷한 상황이죠. 이러한 환가료는 은행의 서비스에 대한 정당한 보상이라고 할 수 있어요. 만약 은행이 원화로 대금을 수취하게 되면 환가료 대신 환율에 다른 수수료가 포함되어 있을 수 있지만, 그 경우에는 환가료가 따로 발생하지 않는다고 보시면 됩니다.']"
[['00b0c275-5eca-4e86-ad0c-768730f44349']],da935dac-966d-4363-9a55-2ae26e068cf7,'방카슈랑스'란 무엇인가요?,"['방카슈랑스는 은행과 보험사가 협력하여 고객에게 금융 상품을 제공하는 시스템이에요. 쉽게 말해, 은행에서 통장을 만들러 갔는데 보험 상품까지 상담 받을 수 있는 경우라고 생각해보세요. 원래는 은행은 예금이나 대출 같은 금융 서비스를 제공하고, 보험사는 보험 상품을 판매하죠. 하지만 방카슈랑스를 통해 은행에서도 쉽게 보험 상품을 접할 수 있고, 여러 가지 금융 서비스를 한 곳에서 받을 수 있는 장점이 생깁니다. 이를 통해 고객은 더 편리하게 금융 계획을 세울 수 있는 것이죠. 예를 들어, 여행을 계획하면서 여행자 보험도 같은 은행에서 간편하게 가입할 수 있는 그런 경험이 방카슈랑스의 대표적인 예라고 할 수 있어요.']"
[['4e28d642-60fe-45db-a6ce-099da1a7bfc5']],2841977a-df06-4bdf-bc70-0056bbbe05bc,'상품공동기금(CFC)'이란 무엇인가요?,"['상품공동기금, 영어로는 Common Fund for Commodities(CFC)이라고 하는데요, 이것은 여러 나라가 모여 만든 국제적인 협력 기금입니다. 이 기금의 주 목적은 1차산품, 즉 원자재나 기본적인 상품들의 공급과 수요를 안정시키는 거예요. 예를 들어, 커피나 설탕 같은 원자재의 가격 변동이 심할 때, 이 기금이 그 변동 폭을 완화시켜주는 역할을 합니다. 마치 편안한 베개처럼 상품의 가격을 안정적으로 유지해 주는 것이죠.\n\n이 기금은 1989년에 설립돼서, 2021년 기준으로 101개 나라와 몇몇 국제 기구가 참여하고 있어요. 그리고 우리나라도 처음 설립되었을 때부터 참여하고 있답니다. 실제로 커피 한 잔의 가격이 갑자기 두 배가 오르지 않도록 이 기금이 도움을 줄 수 있는 것이죠. 마치 비상시에 꺼내 쓸 수 있는 소중한 저금통 같은 역할을 한다고 볼 수 있어요.']"
[['72f903b2-5f8e-4649-8c4d-93a4b817ddac']],fafa3f13-c8fe-4d53-ad37-b60178b9517a,'선물환거래'란 무엇인가요?,"['선물환거래는 약속한 날짜에 미리 정해진 환율로 외화를 사고파는 거래를 말해요. 현재 정한 환율로 미래에 외화를 교환하겠다고 약속하는 거죠. 예를 들어, 해외 여행을 계획 중인데, 갑자기 환율이 오를까 걱정이라면 지금 환율이 좋을 때 미리 달러를 사두고, 여행 전에 그 사용 날짜에 맞춰 거래를 확정할 수 있는 것과 비슷해요. 이 방식은 환율이 오르든 내리든 미리 정해둔 환율로 거래할 수 있어, 금리나 환율 변동으로 인한 손실을 막을 수 있답니다. 그래서 많은 기업들이 환율의 불확실성을 줄이기 위해 이런 선물환거래를 활용하곤 해요.']"
[['a9ca10f9-57b3-4d64-b05a-fbde80740e1a']],f772e5dd-cdf5-43fa-ad7a-a8763c0661ec,'신흥시장국채권지수(EMBI+)'란 무엇인가요?,"['신흥시장국채권지수, 즉 EMBI+(Emerging Market Bond Index +)는 신흥시장국가들이 발행한 채권의 투자수익률을 나타내는 지수입니다. 이 지수는 주로 달러화로 발행된 신흥국 정부 채권을 기반으로 하며, 투자은행인 JPMorgan에서 벤치마크로 활용하고 있어요. 쉽게 말해, 운동경기에서 점수를 매겨 순위를 매기듯이, EMBI+는 신흥국 채권에 얼마나 투자하면 좋을지를 판단할 수 있는 기준점을 제공합니다. \n\n예를 들어, 우리는 더 위험한 산을 오르면 더 많은 보상(멋진 경치)을 기대할 수 있지만, 그만큼 안전에도 주의해야 합니다. 신흥시장 채권은 이러한 상황과 비슷해요. 더 높은 이자(금리)를 제공하지만, 그만큼 더 많은 위험이 따릅니다. 그리고 EMBI+의 수익률에서 미국과 같은 안전한 국채의 수익률을 뺀 값을 EMBI+ 스프레드라고 하는데요, 이 스프레드가 커질수록 신흥국의 투자 위험이 증가했다는 신호로 볼 수 있습니다. 즉, 경제의 맥박을 느껴볼 수 있는 도구라고 할 수 있죠.']"
[['61d400cd-8b58-4992-8ab6-b4299f1ac994']],e52eb699-89a9-49de-bf2d-5affabbf3c2e,'DebtRank'란 무엇인가요?,"['DebtRank는 금융권에서 사용하는 개념으로, 한 은행이 부도가 났을 때 그 영향이 다른 금융기관에 얼마나 전파될지를 측정하는 지표입니다. 쉽게 말해, 무너지는 도미노가 얼마나 많은 다른 도미노를 무너뜨릴 수 있는지를 보는 것이죠. 예를 들어, 친구들이 각각 자신의 저금통을 가지고 있다고 상상해 보세요. 한 친구가 돈을 잃으면 다른 친구들에게도 영향을 미쳐 저금통이 비어갈 수 있는 상황을 나타내죠. 이처럼 금융기관들도 상호 연결되어 있어 하나의 문제가 전체 시스템에 큰 영향을 미칠 수 있습니다. DebtRank가 높다는 것은 이런 부정적인 효과가 클 수 있음을 의미하며, 이러한 상황을 통해 우리는 금융의 상호 연결성이 얼마나 중요한지를 이해할 수 있어요.']"
[['81373972-ef70-4081-b226-baba22cdb6ed']],cd6b44ba-8f77-4396-90d5-69393bc25f82,'순이자마진(NIM)'이란 무엇인가요?,"['순이자마진(NIM)은 우리 은행이 돈을 얼마나 잘 벌고 있는지를 보여주는 지표예요. 은행은 우리가 저축한 돈을 가지고 다른 사람이나 기업에 대출해주고 이자를 받죠. 하지만, 그 돈을 대출해 주고 이자를 받는 데에도 은행 자체적으로 비용이 발생합니다. 순이자마진은 이자 수입에서 그러한 비용을 뺀 후, 은행이 운용하는 전체 자산 대비 얼마나 이익을 내고 있는지를 나타내는 거예요. 예를 하나 들어보면, 우리가 집에서 레모네이드 가게를 운영한다고 할 때, 레모네이드를 만드는 데 드는 비용(설탕, 레몬 등)을 빼고, 판매해서 얻은 돈 중에 남는 부분을 레모네이드 순이자마진이라고 볼 수 있는 거죠. 이 지표는 은행이 얼마나 효율적으로 이자 수익을 창출하고 있는지를 보여주기 때문에 매우 중요한 역할을 한답니다.']"
[['b955c2eb-23c7-4fb5-8e47-b215d70e478c']],cbd7299c-c937-4dac-8936-24323d86c192,'레그테크'란 무엇인가요?,"['레그테크는 금융업 같은 산업에서 규제를 더 효율적으로 관리하기 위해 첨단 기술을 활용하는 것을 의미해요. 쉽게 말해, 레그테크는 회사가 법이나 규정을 잘 지키도록 돕는 도우미 역할을 하는 기술이에요. 예를 들어, 은행이 규정에 맞게 많은 고객 데이터를 안전하게 관리해야 할 때, 수작업 대신 레그테크를 사용해서 데이터를 빠르게 분석하고 관리할 수 있죠. 이렇게 되면 은행은 중요한 정보를 쉽게 찾아내고, 필요한 보고서를 빠르게 작성해서 규제 당국에 제출할 수 있어요. 마치 집안일을 도와주는 스마트 로봇처럼, 복잡한 규제 업무를 기술로 효율적으로 처리하는 방법이라고 생각할 수 있습니다.']"
[['15c0f1aa-9101-4dc5-a8a0-49564fdc1db4']],343e17bc-559e-4177-87da-97746faf4e44,'국민계정체계(SNA)'란 무엇인가요?,"[""국민계정체계(SNA)는 국가의 경제 활동을 체계적으로 기록하고 분석하는 일종의 '경제 보고서'에요. 마치 우리의 가계부가 집안의 돈이 어떻게 쓰이고 들어오는지를 기록하는 것처럼, SNA는 국가 경제가 어디서 돈을 벌고, 어떻게 쓰이는지를 보여줍니다. 예를 들어, 우리 집에서 아빠의 월급과 엄마의 소득, 내 용돈이 가계부에 기록되듯이, SNA는 생산된 상품과 서비스의 가치, 소득의 분배, 자본의 조달과 축적 등을 기록합니다. 이렇게 여러 경제 활동을 체계적으로 파악하면, 국가의 경제 건강상태를 쉽게 이해하고 적절한 경제 정책을 세우는데 큰 도움이 됩니다.""]"
[['437977e3-59e8-4c64-8bd7-48f6f0a15e12']],b6868384-6568-4196-8d3a-2af75afabdbb,'통합발행제도'란 무엇인가요?,"['통합발행제도는 일정 기간 동안 발행되는 채권이 동일한 조건을 가지도록 만들어 하나의 채권으로 취급하는 제도입니다. 예를 들어, 친구들과 함께 매달 모이기로 했다고 상상해보세요. 각각의 모임 날짜와 장소를 모아 하나의 일정표로 만들면 관리하기 쉬운 것처럼, 채권도 이렇게 정리할 수 있습니다. 이를 통해 채권의 종류를 줄이고 거래가 더 편리해지며, 채권에 대한 수요를 높일 수 있어서 매우 효과적입니다. 국채나 통화안정증권과 같은 곳에서 이 제도를 활용하고 있어요.']"
[['20917105-b394-4334-9bb5-987ba3f54c17']],4c52d9e5-22b9-45df-aa3a-c1d9160e7f3b,'총산출'이란 무엇인가요?,"['총산출(Gross Output)은 한 나라나 한 기업이 일정 기간 동안 만들어 낸 모든 상품과 서비스의 가치를 더한 것을 의미합니다. 쉽게 말해, 우리가 공장에서 만들어진 물건부터 시작해서 가게에서 제공되는 서비스까지 모든 것을 화폐로 평가해서 합친 것이죠. 예를 들어, 한 제빵사가 한 달 동안 1,000개의 빵을 구워서 1개에 2,000원씩 팔았다면 그 제빵사의 총산출은 1,000개 × 2,000원 = 2,000,000원이 됩니다. 하지만 여기엔 빵을 만드는 데 필요한 밀가루나 우유 같은 원재료 비용도 포함되어 있습니다. 마찬가지로, 헤어살롱에서 고객에게 제공하는 서비스 역시 총산출에 포함돼요. 다만, 정부나 비영리 단체가 제공하는 서비스처럼 시장에서 직접 거래되지 않는 것들은 서비스를 만드는데 들어간 비용을 기반으로 평가합니다. 즉, 총산출은 경제활동의 다양한 측면을 돈으로 계산해서 이해할 수 있게 해주는 중요한 개념이에요.']"
[['007ce596-949e-4390-9905-94c18360d129']],137a0774-113a-47aa-9536-eb460232b797,‘이표채’란 무엇인가요?,"['이표채는 우리가 돈을 빌리면서 매달 이자를 받는 것처럼, 채권이라는 투자 상품에서 일정 기간마다 정기적으로 이자를 받는 방식의 채권이에요. 이런 형태의 채권을 이표채라고 부르는데요. 쉽게 말해, 돈을 누군가에게 빌려주면 그 대가로 정기적으로 이자를 받을 수 있는 투자 방법이라고 생각하시면 됩니다. 이표(쿠폰)가 붙어 있기 때문에 이자가 지급될 때 이를 제시하여 받을 수 있습니다. 예를 들어, 매년 정해진 날에 이자를 받을 수 있는 저축계좌와 비슷한 개념이라 할 수 있어요. 이런 방식으로 투자하면, 돈을 꾸준히 받기 때문에 마치 우리가 정기적으로 용돈을 받는 것처럼 안정적입니다. 또한, 이자가 주기적으로 지급되기 때문에 투자자의 입장에서는 초기 투자금을 일부 회수해서 다시 투자할 수 있는 기회가 생기기도 하죠. 이렇게 주기적으로 이자를 받는 것이 이표채의 큰 장점 중 하나랍니다.']"
[['9a578e72-2e60-4545-91f7-938ba16bfdc4']],01229f2c-c4fe-43a8-a0fb-e64fcd883f32,‘정부당좌예금계정’이란 무엇인가요?,"['정부당좌예금계정은 정부의 재정 활동을 위해 돈을 관리하는 특별한 계좌라고 생각하면 됩니다. 마치 우리가 월급을 받거나 생활비를 관리하기 위해 은행계좌를 사용하는 것과 비슷해요. 정부의 세금 수입이나 지출, 예를 들어 도로를 건설하거나 병원을 운영하는 데 드는 비용들이 이 계좌를 통해 정리됩니다. 특별히 한국은행 본부에 설치된 이 계정은 모든 국고금의 수입과 지출을 투명하게 관리하도록 돕습니다. 중요한 것은 이 계정이 일반 회계와 특별 회계, 그리고 다양한 기금을 나누어 관리한다는 점인데, 이는 정부가 돈을 어디에, 어떻게 쓰는지를 체계적으로 기록하기 위함입니다. 마치 우리가 용돈을 여러 용도로 나누어 쓰는 것과 같다고 할 수 있어요.']"
[['c567e58d-9528-49b4-8eaf-2b91c86e013e']],6d1994d2-c041-405d-9c43-660283b5fd69,'풋옵션'이란 무엇인가요?,"[""풋옵션은 미리 정한 가격으로 특정 자산을 팔 수 있는 권리를 매매하는 계약이에요. 쉽게 말해, 자산을 '팔 권리'를 사는 것이라고 생각하시면 돼요. 여기서 자산이란 주식이나 주가지수, 통화, 금리 등 여러 가지가 될 수 있어요. 예를 들어 볼게요. 재철 씨는 지금 5,000원인 주식을 가지고 있는데, 앞으로 가격이 떨어질까 걱정이 돼요. 이럴 때 재철 씨는 풋옵션을 사서 미리 정한 가격, 즉 5,000원으로 팔 수 있는 권리를 확보할 수 있어요. 만약 주식 가격이 3,000원으로 떨어진다면, 재철 씨는 기쁘게도 여전히 5,000원에 팔 수 있어서 이익을 볼 수 있죠. 반대로 주식 가격이 6,000원으로 올라가면, 그냥 권리를 포기하고 프리미엄만 손해 보니 안팔아도 되는 게 장점이네요. 이는 재철 씨가 손실을 피하고 안전망을 갖출 수 있는 방법이에요. 이런 식으로 풋옵션은 변동성이 큰 금융 시장에서 자신을 보호할 수 있는 도구가 될 수 있답니다.""]"
[['3a83e266-8419-4bd1-bc2c-b6f7dab4f004']],4106b068-fed2-4b7a-95dc-a4155fe9b151,‘전자어음’이란 무엇인가요?,"['전자어음은 실물이 아닌 전자적 형태로 발행된 약속어음입니다. 쉽게 말해, 우리가 보통 종이로 주고받던 약속어음을 컴퓨터로 주고받는다고 생각하면 돼요. 이 전자어음은 발행, 사용, 그리고 끝나는 모든 과정이 온라인에서 이루어지지만, 법적인 효력은 종이 약속어음과 똑같아요. 특히 전자어음의 발행과 거래를 통해 거래 기록이 투명해지고, 어음의 분실이나 도난 같은 문제를 줄일 수 있답니다. 예를 들어, 친구에게 돈을 빌려주고 그 대신 ""3개월 후에 꼭 갚겠다""는 약속을 종이가 아닌 이메일이나 컴퓨터 프로그램으로 받아두는 것과 비슷하죠. 이런 방식으로 어음 관리 비용도 줄어들고, 좀 더 안전하게 어음 거래를 진행할 수 있어요.']"
[['56428fb1-1bb7-42bb-b10c-8db65a67806e']],9ed2b727-bf5c-4d67-9879-cb7be860f88f,'실업률갭'이란 무엇인가요?,"[""실업률갭은 현재의 실업률과 자연실업률 간의 차이를 의미해요. 자연실업률은 경제가 건강하게 운영될 때의 실업률을 말하죠. 실업률갭을 통해 우리는 노동 시장의 여유가 얼마나 있는지를 알 수 있어요. 예를 들어, 우리는 주말에 슈퍼마켓에 갔을 때 사람들이 별로 없으면 '사람이 없어서 여유롭네'라고 생각할 수 있어요. 이처럼 실업률갭이 양수(+)라는 건 노동시장에서 인력이 풍부하게 남아돌아 경제에 압박이 없다는 것을 의미하고, 음수(-)라는 건 필요한 일자리에 비해 사람들이 충분하지 않아 그만큼 인력을 구하는 데 어려움이 있다는 걸 나타내요. 이러한 정보는 중앙은행이 정책을 결정할 때 중요한 참고자료가 됩니다. 하지만 자연실업률을 정확히 계산하기가 쉽지 않다는 점에서 중앙은행이 실업률갭만을 기반으로 정책을 추진하는 데 어려움이 있을 수 있습니다.""]"
[['703c0cd5-5301-4b37-9945-ebf9ece74baa']],d05c521a-0157-4059-852c-5530084467b0,‘스톡옵션’이란 무엇인가요?,"['스톡옵션은 회사에서 직원들에게 주는 특별한 권리입니다. 예를 들어, 회사가 열심히 일한 당신에게 ""우리 회사의 주식을 지금보다 더 싸게 살 수 있게 해줄게요""라고 제안하는 것입니다. 만약 회사가 성장해서 주식의 가격이 오른다면, 직원은 저렴한 가격에 산 주식을 더 비싼 가격에 팔아 수익을 얻을 수 있습니다. 이는 마치 영화관에서 영화표를 사전 판매할 때 할인된 가격으로 사고, 나중에 그 영화가 인기를 끌면서 표가 비싸졌을 때 웃으면서 입장하는 것과 같습니다. 이렇게 스톡옵션은 직원들에게 회사의 성장과 함께 더 큰 보상을 받을 수 있는 기회를 제공해요.']"
[['d3a514a6-e5c8-409e-8fa2-6a082ffe2e73']],e878ad65-519a-4b82-9d71-4431da723e99,'집중도 지수(HHI)'란 무엇인가요?,"['집중도 지수(HHI)는 특정 산업에서 큰 기업들이 얼마나 많은 시장을 차지하고 있는지를 숫자로 표현한 것입니다. 예를 들어, 놀이공원에 100명의 손님이 있는데, 그중 90명이 한 놀이기구에만 탄다면, 그 놀이기구는 손님을 많이 잡고 있는 셈이죠. 이처럼, 어떤 산업에서도 몇몇 큰 기업들이 대부분의 시장을 차지하고 있으면, 그 산업의 집중도 지수가 높아진다고 해요. 미국에서는 이런 현상을 막기 위해 큰 기업들이 합병을 할 때, HHI를 사용해 그들이 시장을 과도하게 지배하지 않도록 조절합니다. HHI 값이 1000 이하면 시장의 집중도가 낮다고 보고, 1800 이상으로 올라가면 집중도가 높아짐을 의미하죠. 이런 지표를 통해 공정한 경쟁이 이루어질 수 있도록 하는 거랍니다.']"
